{
  "schema": "pms-eval-result/v1",
  "taskId": "design-system-extension-positive-warning-status",
  "split": "development",
  "workflow": "design-system-extension",
  "caseType": "positive",
  "epoch": "alpha1",
  "classification": "missing-project-vocabulary",
  "intendedOutcome": "application-success",
  "verdict": "pass",
  "success": {
    "application": true,
    "diagnosis": null,
    "report": null
  },
  "outcomes": {
    "scope": "pass",
    "integrity": "pass",
    "compile": "pass",
    "static": "pass",
    "rendered": "pass",
    "behavioral": "pass",
    "report": "not-applicable",
    "transcript": "not-applicable",
    "environment": "not-applicable",
    "visual": "not-applicable"
  },
  "scope": {
    "added": [],
    "modified": [
      "design.pandamstyle.config.js",
      "src/components/ProductCard.jsx",
      "src/components/StockBadge.jsx"
    ],
    "deleted": [],
    "symlinks": []
  },
  "compile": {
    "ok": true,
    "diagnosticCodes": [],
    "compilerVersion": "0.1.0-alpha.1"
  },
  "report": {
    "present": true,
    "outcome": "completed",
    "gaps": [
      {
        "kind": "ambiguous-request",
        "subject": "contrast of white badge text on colors.status.warning (#d97706)",
        "detail": "Approximately 3.2:1, below WCAG AA 4.5:1 for 14px bold text. Left unchanged because the ticket asked for the same structure as the other statuses. Needs a design decision."
      }
    ]
  },
  "checks": [
    {
      "id": "scope",
      "kind": "scope.diff",
      "class": "scope",
      "required": true,
      "status": "pass",
      "reason": null,
      "evidence": {
        "added": [],
        "modified": [
          "design.pandamstyle.config.js",
          "src/components/ProductCard.jsx",
          "src/components/StockBadge.jsx"
        ],
        "deleted": [],
        "symlinks": []
      }
    },
    {
      "id": "compile",
      "kind": "compile.project",
      "class": "compile",
      "required": true,
      "status": "pass",
      "reason": null,
      "evidence": {
        "coveredModules": 8
      }
    },
    {
      "id": "no-bypass",
      "kind": "static.forbidden",
      "class": "static",
      "required": true,
      "status": "pass",
      "reason": null,
      "evidence": {
        "filesInspected": 10
      }
    },
    {
      "id": "generated-untouched",
      "kind": "generated.consistent",
      "class": "integrity",
      "required": true,
      "status": "pass",
      "reason": null,
      "evidence": {
        "note": "fresh compiler generation",
        "files": 14
      }
    },
    {
      "id": "vocabulary-diff",
      "kind": "definition.diff",
      "class": "integrity",
      "required": true,
      "status": "pass",
      "reason": null,
      "evidence": {
        "added": [
          "token:colors.status.warning",
          "variant:badge.status.warning"
        ],
        "removed": [],
        "changed": []
      }
    },
    {
      "id": "warning-badge",
      "kind": "render.styles",
      "class": "rendered",
      "required": true,
      "status": "pass",
      "reason": null,
      "evidence": {
        "classes": [
          "x3nfvp2",
          "x6s0dn4",
          "xa3qa6q",
          "x54c1fo",
          "xqn6m5w",
          "xdb7zta",
          "x1kebkhh",
          "x11kc7bu"
        ],
        "text": "Low stock",
        "styles": {
          "background-color": "var(--x18b3u3p)"
        }
      }
    },
    {
      "id": "sold-out-badge",
      "kind": "render.styles",
      "class": "behavioral",
      "required": true,
      "status": "pass",
      "reason": null,
      "evidence": {
        "classes": [
          "x3nfvp2",
          "x6s0dn4",
          "xa3qa6q",
          "x54c1fo",
          "xqn6m5w",
          "xdb7zta",
          "x1kebkhh",
          "x1yv3cl8"
        ],
        "text": "Sold out",
        "styles": {
          "background-color": "var(--x1i1hd8r)"
        }
      }
    },
    {
      "id": "card-wiring",
      "kind": "render.styles",
      "class": "behavioral",
      "required": true,
      "status": "pass",
      "reason": null,
      "evidence": {
        "classes": [
          "x3nfvp2",
          "x6s0dn4",
          "xa3qa6q",
          "x54c1fo",
          "xqn6m5w",
          "xdb7zta",
          "x1kebkhh",
          "x11kc7bu"
        ],
        "text": "Low stock"
      }
    }
  ]
}