{
  "schema": "pms-eval-result/v1",
  "taskId": "recovery-boundary-missing-generated-files",
  "split": "development",
  "workflow": "recovery",
  "caseType": "boundary",
  "epoch": "alpha1",
  "classification": "expressible",
  "intendedOutcome": "application-success",
  "verdict": "pass",
  "success": {
    "application": true,
    "diagnosis": null,
    "report": null
  },
  "outcomes": {
    "scope": "pass",
    "integrity": "pass",
    "compile": "pass",
    "static": "pass",
    "rendered": "pass",
    "behavioral": "not-applicable",
    "report": "not-applicable",
    "transcript": "not-applicable",
    "environment": "not-applicable",
    "visual": "not-applicable"
  },
  "scope": {
    "added": [],
    "modified": [],
    "deleted": [],
    "symlinks": []
  },
  "compile": {
    "ok": true,
    "diagnosticCodes": [],
    "compilerVersion": "0.1.0-alpha.1"
  },
  "report": {
    "present": true,
    "outcome": "completed",
    "gaps": []
  },
  "checks": [
    {
      "id": "scope",
      "kind": "scope.diff",
      "class": "scope",
      "required": true,
      "status": "pass",
      "reason": null,
      "evidence": {
        "added": [],
        "modified": [],
        "deleted": [],
        "symlinks": []
      }
    },
    {
      "id": "compile",
      "kind": "compile.project",
      "class": "compile",
      "required": true,
      "status": "pass",
      "reason": null,
      "evidence": {
        "coveredModules": 4
      }
    },
    {
      "id": "generated-regenerated",
      "kind": "generated.consistent",
      "class": "integrity",
      "required": true,
      "status": "pass",
      "reason": null,
      "evidence": {
        "note": "fresh compiler generation",
        "files": 10
      }
    },
    {
      "id": "no-bypass",
      "kind": "static.forbidden",
      "class": "static",
      "required": true,
      "status": "pass",
      "reason": null,
      "evidence": {
        "filesInspected": 6
      }
    },
    {
      "id": "notes-render",
      "kind": "render.styles",
      "class": "rendered",
      "required": true,
      "status": "pass",
      "reason": null,
      "evidence": {
        "classes": [
          "x91bo0q",
          "x14atpvv",
          "x51acp5",
          "x1mkomhf"
        ],
        "text": "New note Groceries Oat milk, lemons, rice. Ideas Weekly review template.",
        "styles": {
          "background-color": "var(--x1t5ymp5)"
        }
      }
    }
  ]
}