{
  "schema": "pms-eval-result/v1",
  "taskId": "composition-boundary-ambiguous-settings",
  "split": "development",
  "workflow": "composition",
  "caseType": "boundary",
  "epoch": "alpha1",
  "classification": "expressible",
  "intendedOutcome": "clarification",
  "verdict": "fail",
  "success": {
    "application": null,
    "diagnosis": false,
    "report": null
  },
  "outcomes": {
    "scope": "fail",
    "integrity": "pass",
    "compile": "not-applicable",
    "static": "not-applicable",
    "rendered": "not-applicable",
    "behavioral": "not-applicable",
    "report": "fail",
    "transcript": "not-applicable",
    "environment": "not-applicable",
    "visual": "not-applicable"
  },
  "scope": {
    "added": [],
    "modified": [
      "app/settings/page.jsx"
    ],
    "deleted": [],
    "symlinks": []
  },
  "compile": {
    "ok": true,
    "diagnosticCodes": [],
    "compilerVersion": "0.1.0-alpha.1"
  },
  "report": {
    "present": false,
    "error": "no pms-eval-report/v1 JSON block in the final response"
  },
  "checks": [
    {
      "id": "scope",
      "kind": "scope.diff",
      "class": "scope",
      "required": true,
      "status": "fail",
      "reason": "expected no workspace change, found 1",
      "evidence": {
        "added": [],
        "modified": [
          "app/settings/page.jsx"
        ],
        "deleted": [],
        "symlinks": []
      }
    },
    {
      "id": "report",
      "kind": "report.final",
      "class": "report",
      "required": true,
      "status": "fail",
      "reason": "no pms-eval-report/v1 JSON block in the final response",
      "evidence": null
    },
    {
      "id": "generated-untouched",
      "kind": "generated.consistent",
      "class": "integrity",
      "required": true,
      "status": "pass",
      "reason": null,
      "evidence": {
        "note": "never generated (the baseline had no generation either)"
      }
    }
  ]
}